{
  "$schema": "./manifest.schema.json",
  "schemaVersion": 1,
  "id": "core-v0",
  "grid": {
    "tileWidth": 32,
    "tileHeight": 16,
    "elevation": 8,
    "depthRule": "max-x-plus-y"
  },
  "characterFrame": {
    "width": 24,
    "height": 48
  },
  "characterMotion": {
    "policy": "canonical-idle-v1",
    "identityLocked": true,
    "fallback": "canonical-idle-bob",
    "canonicalFrames": {
      "southeast": "character.gus.southeast.idle",
      "southwest": "character.gus.southwest.idle",
      "northwest": "character.gus.northwest.idle",
      "northeast": "character.gus.northeast.idle"
    }
  },
  "palette": {
    "world": [
      "#0D2228",
      "#17343A",
      "#31584F",
      "#426D61",
      "#4F666B",
      "#637D81",
      "#687C79",
      "#75878A",
      "#777F79",
      "#846F5A",
      "#88634A",
      "#8D6964",
      "#8D9B92",
      "#94A29F",
      "#A87838",
      "#A9AA9E",
      "#A9B6AD",
      "#B36C4F",
      "#B8AD99",
      "#BA6C59",
      "#C3B99C",
      "#C4C5B9",
      "#C7C4B7",
      "#C99D69",
      "#D0CCBD",
      "#D2C9AA",
      "#D5D8CC",
      "#E1D5B1",
      "#EDF0DE",
      "#F0BD91",
      "#FFF2CB",
      "#FFF8DF"
    ],
    "players": [
      "#ED806C",
      "#75BD9F",
      "#78AABC",
      "#F1BF65",
      "#A88BC2",
      "#DC8EB0",
      "#82AE68",
      "#DC9765"
    ]
  },
  "atlases": [
    {
      "id": "core-v0",
      "source": "core-v0.png",
      "width": 512,
      "height": 512,
      "padding": 2
    }
  ],
  "sheets": [
    {
      "id": "character.gus",
      "atlas": "core-v0",
      "frame": {
        "x": 2,
        "y": 316,
        "width": 384,
        "height": 192
      },
      "columns": 16,
      "rows": 4,
      "cellWidth": 24,
      "cellHeight": 48
    }
  ],
  "requiredSlots": [
    "floor.raw-concrete",
    "floor.patched-concrete",
    "floor.light-wood",
    "floor.utility-border",
    "furniture.moving-box",
    "furniture.desk-island",
    "furniture.storage-cabinet",
    "furniture.tea-coffee-bar",
    "furniture.meeting-table",
    "character.gus",
    "effect.good-card-heart"
  ],
  "assets": [
    {
      "id": "floor.raw-concrete",
      "slot": "floor.raw-concrete",
      "kind": "floor",
      "atlas": "core-v0",
      "frame": {
        "x": 2,
        "y": 2,
        "width": 32,
        "height": 16
      },
      "anchor": {
        "x": 16,
        "y": 8
      },
      "offset": {
        "x": 0,
        "y": 0
      },
      "footprint": [
        {
          "x": 0,
          "y": 0,
          "blocked": false
        }
      ],
      "collision": [],
      "layer": -10
    },
    {
      "id": "floor.patched-concrete",
      "slot": "floor.patched-concrete",
      "kind": "floor",
      "atlas": "core-v0",
      "frame": {
        "x": 36,
        "y": 2,
        "width": 32,
        "height": 16
      },
      "anchor": {
        "x": 16,
        "y": 8
      },
      "offset": {
        "x": 0,
        "y": 0
      },
      "footprint": [
        {
          "x": 0,
          "y": 0,
          "blocked": false
        }
      ],
      "collision": [],
      "layer": -10
    },
    {
      "id": "floor.light-wood",
      "slot": "floor.light-wood",
      "kind": "floor",
      "atlas": "core-v0",
      "frame": {
        "x": 70,
        "y": 2,
        "width": 32,
        "height": 16
      },
      "anchor": {
        "x": 16,
        "y": 8
      },
      "offset": {
        "x": 0,
        "y": 0
      },
      "footprint": [
        {
          "x": 0,
          "y": 0,
          "blocked": false
        }
      ],
      "collision": [],
      "layer": -10
    },
    {
      "id": "floor.utility-border",
      "slot": "floor.utility-border",
      "kind": "floor",
      "atlas": "core-v0",
      "frame": {
        "x": 104,
        "y": 2,
        "width": 32,
        "height": 16
      },
      "anchor": {
        "x": 16,
        "y": 8
      },
      "offset": {
        "x": 0,
        "y": 0
      },
      "footprint": [
        {
          "x": 0,
          "y": 0,
          "blocked": false
        }
      ],
      "collision": [],
      "layer": -10
    },
    {
      "id": "furniture.moving-box",
      "slot": "furniture.moving-box",
      "kind": "furniture",
      "atlas": "core-v0",
      "frame": {
        "x": 2,
        "y": 22,
        "width": 48,
        "height": 64
      },
      "anchor": {
        "x": 24,
        "y": 52
      },
      "offset": {
        "x": 0,
        "y": 0
      },
      "footprint": [
        {
          "x": 0,
          "y": 0,
          "blocked": true
        }
      ],
      "collision": [
        {
          "x": 0,
          "y": 0
        }
      ],
      "layer": 0
    },
    {
      "id": "furniture.desk-island",
      "slot": "furniture.desk-island",
      "kind": "furniture",
      "atlas": "core-v0",
      "frame": {
        "x": 52,
        "y": 22,
        "width": 96,
        "height": 80
      },
      "anchor": {
        "x": 48,
        "y": 64
      },
      "offset": {
        "x": 0,
        "y": 0
      },
      "footprint": [
        {
          "x": 0,
          "y": 0,
          "blocked": true
        },
        {
          "x": 1,
          "y": 0,
          "blocked": true
        },
        {
          "x": 2,
          "y": 0,
          "blocked": true
        },
        {
          "x": 0,
          "y": 1,
          "blocked": true
        },
        {
          "x": 1,
          "y": 1,
          "blocked": true
        },
        {
          "x": 2,
          "y": 1,
          "blocked": true
        }
      ],
      "collision": [
        {
          "x": 0,
          "y": 0
        },
        {
          "x": 1,
          "y": 0
        },
        {
          "x": 2,
          "y": 0
        },
        {
          "x": 0,
          "y": 1
        },
        {
          "x": 1,
          "y": 1
        },
        {
          "x": 2,
          "y": 1
        }
      ],
      "layer": 0
    },
    {
      "id": "furniture.storage-cabinet",
      "slot": "furniture.storage-cabinet",
      "kind": "furniture",
      "atlas": "core-v0",
      "frame": {
        "x": 150,
        "y": 22,
        "width": 80,
        "height": 72
      },
      "anchor": {
        "x": 40,
        "y": 64
      },
      "offset": {
        "x": 0,
        "y": 0
      },
      "footprint": [
        {
          "x": 0,
          "y": 0,
          "blocked": true
        },
        {
          "x": 1,
          "y": 0,
          "blocked": true
        }
      ],
      "collision": [
        {
          "x": 0,
          "y": 0
        },
        {
          "x": 1,
          "y": 0
        }
      ],
      "layer": 0
    },
    {
      "id": "furniture.tea-coffee-bar",
      "slot": "furniture.tea-coffee-bar",
      "kind": "furniture",
      "atlas": "core-v0",
      "frame": {
        "x": 232,
        "y": 22,
        "width": 80,
        "height": 72
      },
      "anchor": {
        "x": 40,
        "y": 64
      },
      "offset": {
        "x": 0,
        "y": 0
      },
      "footprint": [
        {
          "x": 0,
          "y": 0,
          "blocked": true
        },
        {
          "x": 1,
          "y": 0,
          "blocked": true
        }
      ],
      "collision": [
        {
          "x": 0,
          "y": 0
        },
        {
          "x": 1,
          "y": 0
        }
      ],
      "layer": 0
    },
    {
      "id": "furniture.meeting-table",
      "slot": "furniture.meeting-table",
      "kind": "furniture",
      "atlas": "core-v0",
      "frame": {
        "x": 314,
        "y": 22,
        "width": 128,
        "height": 96
      },
      "anchor": {
        "x": 64,
        "y": 80
      },
      "offset": {
        "x": 0,
        "y": 0
      },
      "footprint": [
        {
          "x": 0,
          "y": 0,
          "blocked": true
        },
        {
          "x": 1,
          "y": 0,
          "blocked": true
        },
        {
          "x": 2,
          "y": 0,
          "blocked": true
        },
        {
          "x": 3,
          "y": 0,
          "blocked": true
        },
        {
          "x": 0,
          "y": 1,
          "blocked": true
        },
        {
          "x": 1,
          "y": 1,
          "blocked": true
        },
        {
          "x": 2,
          "y": 1,
          "blocked": true
        },
        {
          "x": 3,
          "y": 1,
          "blocked": true
        }
      ],
      "collision": [
        {
          "x": 0,
          "y": 0
        },
        {
          "x": 1,
          "y": 0
        },
        {
          "x": 2,
          "y": 0
        },
        {
          "x": 3,
          "y": 0
        },
        {
          "x": 0,
          "y": 1
        },
        {
          "x": 1,
          "y": 1
        },
        {
          "x": 2,
          "y": 1
        },
        {
          "x": 3,
          "y": 1
        }
      ],
      "layer": 0
    },
    {
      "id": "character.gus.southeast.idle",
      "slot": "frame.character.gus.southeast.idle",
      "kind": "character",
      "atlas": "core-v0",
      "frame": {
        "x": 2,
        "y": 316,
        "width": 24,
        "height": 48
      },
      "anchor": {
        "x": 12,
        "y": 46
      },
      "offset": {
        "x": 0,
        "y": 0
      },
      "footprint": [
        {
          "x": 0,
          "y": 0,
          "blocked": false
        }
      ],
      "collision": [],
      "layer": 2
    },
    {
      "id": "character.gus.southeast.idle.1",
      "slot": "frame.character.gus.southeast.idle.1",
      "kind": "character",
      "atlas": "core-v0",
      "frame": {
        "x": 26,
        "y": 316,
        "width": 24,
        "height": 48
      },
      "anchor": {
        "x": 12,
        "y": 46
      },
      "offset": {
        "x": 0,
        "y": 0
      },
      "footprint": [
        {
          "x": 0,
          "y": 0,